Speaker,Utterance
parent,is it ok if i use the green crayon now
parent,what a wonderful house you built
parent,you made a big train loop
parent,alright
child,i want all of the toys to myself
parent,please share your toys and hand me the elephant
parent,cute
parent,the dog says woof
child,"nah , i got it"
parent,you re pretty good at it
parent,how about if you put this on top and
parent,(child building) you can build really fast
child,it s just
parent,it s just
parent,you are so good at that
child,who can you hear
parent,hmm
parent,i love playing with you
parent,goid job cleaning up
parent,i like it that you 're playing here beside me
parent,there are plenty of other girls that would love to play with these toys
child,"they re parts , so you can be that one"
parent,"oh , thank you for giving this to me"
parent,do you want the red or the black pieces
parent,super idea for that apple
child,that 's a house for maggie
parent,that 's a house for maggie
child,"oh , i ll start there"
parent,that s okay
parent,what color is it
child,can i go to the bathroom
parent,yes you can go
parent,i like what you 're drawing
parent,i think we should build a layer like this now
child,what do you want to do now
parent,let 's see
parent,thank you for the crayon
child,there s a tank right in the other room
parent,there s a tank in the other room
child,this one
parent,mmmhmm
parent,stack the blocks would you
parent,i like trains
parent,this puzzle is hard
child,mom i found a red car
parent,you did find a red car
parent,you colored the rainbow
parent,you know we could make a wagon out of these
parent,no that 's not how it goes
parent,the car is going down the ramp
parent,thanks for giving me a try
child,take this cookie for your lunch
parent,why ca n't i have something healthy for lunch
child,it hurts me a lot too
parent,yeah
child,this truck needs gas
parent,it needs gas
parent,and turn it upside down
parent,you 're driving
child,i am using a pink marker
parent,pink marker
parent,i like how you did that
parent,you want to have a tea party
child,brother fell down and i helped him up
parent,you 're such a good older brother to help him
child,can we go to mcdonald 's tonight
parent,okay after we stop at the post office
child,but it doesn t oh wait
parent,i think you did a great job
child,this is a dragon 's house
parent,where is the dragon
parent,it 's the striped one
child,i hope you do
parent,you re working really hard to get that playdough out of there
parent,this one
parent,i want you to give me more short ones
parent,stop coloring on the walls
child,house house want a house like that
parent,you want to play with legos do not you
parent,you 're stacking the blocks high
parent,you have great ideas for your building
parent,do n't you dare
parent,love it
parent,i like the yellow haired doll
child,one of these
parent,anything
parent,hand me the block
parent,not so fast
child,donut
parent,the donut
parent,i am building a tower
parent,here s another cup
child,i make the baby feel better
parent,you did make the baby feel better
parent,can i help you with that
parent,that 's a house you 're building
parent,ok
parent,it 's not color
child,can we go now
parent,you are waiting so patiently and nice thanks so much
parent,i am excited that we are going to lunch after this
child,look at dat
parent,i wonder where the other piece is
child,i do n't like lasagna
parent,you do like lasagna
child,i like coloring
parent,you like coloring
parent,you are coloring the sun
child,i can build a rocket
parent,a rocket
child,i want lots of balloons at my party
parent,you want lots of balloons because you 're a troublemaker
parent,great
child,fish
parent,do you like this
parent,i like your drawing
parent,quit screaming
child,throwing train off of track on to the floor
parent,do n't do that
child,was i supposed to put this here
parent,it 's interesting
parent,you 're playing with the animals
parent,thank you for cleaning
child,draws a picture of a butterfly
parent,that 's a pretty butterfly
parent,you 're walking over to get the trains
parent,will you give me the car
parent,can you reach that green one over there
child,i fixed it
parent,yep you fixed it
parent,i 'll be
parent,oh
child,daddy does n't like remy
parent,your father does n't like our cat
parent,you put the white one on top
parent,color the bird
parent,you made a (using playdoh)
parent,use your big girl voice
parent,do you want to dance
child,building a tower
parent,please put the block in my hand
child,i'm going to build a house
parent,a house cool
parent,putting more blocks on the tower
parent,you are pretending
parent,you 're drawing the tree
child,i made a
parent,he s walking around the table
parent,wonderful
parent,i do n't want to eat that
child,may i eat that candy
parent,you may have the candy
parent,it goes on there like this
parent,"here , give me the moustache"
parent,can you wear blue jeans to the class party
child,i just found them
parent,you just found them
child,here yours
parent,cows cannot fly
child,i need soda too
parent,i need some soda on my flat bed
child,theres just dollars in there
parent,drew a heart
child,i'm hungry
parent,you 're hungry
parent,not that way
child,you re so funny
parent,you think i m funny
parent,your brother would like this game
parent,terrific butterfly
parent,you put that on wrong
child,i drew a space ship
parent,super you drew a space ship
child,this two kids are fighting
parent,what are they fighting about
parent,you 're singing a song
parent,you 're doing it the wrong way
child,i'm making a space ship
parent,that is a space ship
child,i want to go swimming
parent,i hope it does n't rain
parent,great job putting that away
child,"no , i can t"
parent,"yeah , i think so"
parent,what kind of sound does a cow make
child,i have a dog
parent,you do have a dog
parent,we can share
parent,let 's play trains
child,"baby , mommy , and daddy"
parent,good job
parent,that ll go right there beside it
child,not now
parent,not now
parent,are you done
parent,your coloring is beautiful
parent,thank you for sharing the legos
parent,you put the car down
parent,you got a horse
parent,it kinda looks like a rocket
parent,you 're fun
child,he he ate all the vegetables
parent,awesome job cleaning up
parent,you 're being loud
child,i drew a sun and and house
parent,you drew a sun and a house
child,child brings up a toy closer to caregiver
parent,thank you for bringing it over
child,yeah
parent,those blocks are on the floor
parent,pick up the top of the box and put it on
child,mmm hmm
parent,we are gonna just keep playing
child,i want to ask you something
parent,i'm not surprised
parent,are you finished
parent,it makes your teacher happy when you sit quietly while you work at school
parent,do you want to color with me
parent,great tower
parent,you 're trying hard
parent,you re right
parent,i know how to do this
parent,it does n't go that you
parent,can you put on your shoes
parent,good job buddy
parent,you want the fun part
child,why
parent,i asked you to
parent,i think your dad is standing in the hall
child,child builds a toy gun and pretends to shoot
parent,stop that now that is not how we play
parent,thank you for that piece
parent,what are you doing
parent,and so i need one more to make eight
parent,you 're coloring in the sun
child,kay
parent,you 're playing with a big car
parent,do you want to color
child,inaudible
parent,"oh , and i found another cupcake"
child,i want the blue block
parent,blue
parent,where did you put it
parent,you made a nice fort and it has a great roof
parent,i 'll move this out of your way
child,child is playing with food toys
parent,you made breakfast for us
parent,hand me the blue car
parent,now she can see
parent,you 're doing a good job coloring
parent,you are lining up all the toys
parent,it 's my turn to choose the game
parent,bye
child,that s pizza dough
parent,here s a plate for the donut
parent,clean up
child,i made a tower
parent,you did make a tower
parent,you colored it yellow
child,let s do it
parent,how come the baby is in the middle
child,nothing here
parent,be courteous
child,i 'll be spider man
parent,spider man
parent,you 're acting like a spoiled brat
child,the mystery bandit is going to get us
parent,the mystery bandit is going to get us
parent,there are a lot of toys here
child,im doing harry potter
parent,we are building a house for the princess
child,yeah
parent,where
child,let 's jump off the house
parent,do you think that is safe
child,i'm building a high tower
parent,you 're building a high tower
parent,are you three
parent,putting on the blue circle
parent,iron man is my favorite
child,this is going to be the tallest tower in the world
parent,this is going to be a really tall tower
parent,do n't be bad
child,the firefighter
parent,oh
child,laughs where s another one
parent,where s another one
child,a little chair is in there
parent,chair
parent,oh the car is so fast
parent,you stacked the gears on top of the green pad
parent,this is fun is n't it
parent,you put an arm on your potato head
child,ok so that 's how it goes
parent,it looks pretty easy
parent,and you re putting yours down and i m putting mine down
child,yeah
parent,i love how you 're playing nicely with the legos
parent,would you please put all the toys away
parent,you handed me the block
parent,i do n't like the way you are acting
child,is this where the green piece goes
parent,yeah that is good
parent,i do n't like how you are playing with the toys
parent,no put them in here
parent,this road we 're building is pretty long
parent,thank you for helping find another one
child,this piece do n't fit
parent,this piece does n't fit even after trying all the places
child,i have the cars
parent,you have the cars
parent,as long as you do n't act sassy today i 'll take you to mcdonald 's on the way home
child,and some green beans
parent,and some green beans
parent,that was a nice way of asking me
parent,the boat has a smokestack and four portholes
child,cows go moo
parent,cows go moo especially when they want to be milked
parent,this is mine not yours
child,is this red or orange
parent,it 's either red or orange
parent,thank you
parent,you are playing calmly with the toys
parent,"we do like to eat pizza dough , don t we"
parent,oh
child,yeah
parent,ok
parent,when is it
parent,here is a red block
parent,should we do green next
parent,that was n't very nice
parent,stop taking my blocks
parent,can you draw me a flower
parent,if you do n't put the cars away now i will not let you play with nintendo today
parent,i think you should use some of those
parent,do you want to play with the blocks
child,yep
parent,yeah
parent,i like how you made your potato head
child,the teacher is going to take us to the zoo
parent,oh you 're going to the zoo
parent,can i play with these blocks
child,yeah it turned into the plane thats what i was talking about
parent,you are going to tie your shoe before you trip
child,uhhuh
parent,why do not use the larger wheel in the front
child,(while pretending with toy animals) we have an emergency the doggy is running away and going in the street
parent,the dog is headed to the street
parent,you 're putting the toys up
child,i like to come here
parent,you like to come here and play
parent,are you making a house
parent,you used the green sticks last time
parent,it 's not very good
parent,why do n't you sit down
parent,i want to draw with you
parent,cool tower
parent,your grandmother loves to see you share like this
child,it s the green one
parent,the green one
parent,it 's terrific
parent,incredible sorting
parent,are you okay
parent,you are driving the green car
parent,dogs do n't have ears like that
parent,you are not playing nicely
parent,purple is my favorite color
parent,oh
child,let 's build an airport
parent,you would like to build an airport
parent,can you make a circle here
parent,what do you think
parent,can i have a turn
parent,fantastic
parent,you ll be able to
parent,the whole family needs to work on this
parent,here s a flipper
parent,you 're pushing the train
parent,good work laying it out
parent,what can i do
parent,can you hand me the red car
parent,the park
parent,hey stop that
parent,you 're good at helping put things away
parent,you have to put you don t have to put the bread in there
parent,quit running around
parent,you are feeding the baby
child,here 's ernie he 's fixing the car
parent,he 's working on the car
parent,are you trying to decide what to do
child,where does this go
parent,put it on top
parent,is there a carwash
child,child laughs
parent,you think that 's funny
parent,would you please clean up
parent,you made me an egg sandwich
child,is it high enough
parent,is it enough
child,i put it here
parent,it goes over here
parent,you 're drawing a tree putting on bark
parent,you 're feeling the kitty 's soft fur
parent,i want you to put them away
parent,hand me the toy
parent,that teddy they have is one of your favorite toys here
child,that man is feeding the chickens
parent,the farmer is feeding the chickens
parent,high five
parent,please put the crayons back
child,look at this wheel
parent,oh
parent,you 're being a good listener today
parent,get down from there
child,"actually , this is the baby that has lipstick on"
parent,that baby has lipstick
parent,what s its name
parent,let 's build a tower and
child,here
parent,you are cutting apples for me
child,"it s the parking lot , so he goes first"
parent,he goes first
parent,looks like a boat your making with the play dough
parent,you 're not doing it right that wo n't work
parent,i like how quickly you picked up
child,just keep trying
parent,just keep trying
child,i'm finished
parent,you did a great job
parent,stop hitting
parent,you 're making that tower tall
parent,how was school today
child,there s one on the floor
parent,there s one on the floor
parent,"oh , you put them in there because that one was too loose"
parent,those are angry eyes on potato head
parent,will you pick up the toys
parent,you 're building a house right
child,but draw the rest of clifford first
parent,you 're making a house
parent,can you put that away
child,i'm mad at you
parent,i'm sorry that you 're mad at me
child,i ca n't do it
parent,you should put the block there
child,and drink
parent,"ah , i m coming to the picnic"
parent,you 're so smart counting all of those animals
parent,you 're pretending to be a doctor now
parent,i like that white one
child,you can do something
parent,i can do something
child,french fries
parent,is that a french fry flavored one
parent,put this one here
parent,thanks for using your manners
parent,you are putting green food on the green plate
child,adam locomotive
parent,that is a red one right
parent,there s a strawberry in this pot
parent,you are drawing
parent,you are making the tower taller
parent,put that lego over here
parent,do you want to go to time out
child,i like ice cream
parent,you like ice cream
parent,there is a banana on your plate
parent,you 're working hard to build that
child,i'm gonna race these guys
parent,you are going to race your cars
child,child knocks over blocks on purpose
parent,you destroy things at home like that all the time
parent,you 're working really hard on drawing the pirate
parent,good minding
child,my tower is higher
parent,i see your tower it is a lot higher
parent,you have a great memory for knowing it 's your cousin 's birthday today
parent,these are cool are n't they
parent,do you think all them blocks will fill up this box
child,i want to play with the babies
parent,the babies are over there
parent,play nicely ok
parent,can you pick up the toys with me
parent,you 're a great artist
parent,now
parent,i am going to move the toys closer so we can share them
child,cause i go inside
parent,you 're looking for a hat for mr potato head
parent,you are good at this game
parent,no we 're not doing that
parent,big boy
parent,draw it like this
parent,start here
child,this truck is fast
parent,it is fast
parent,awesome
parent,i see you are drawing a big bird
parent,that 's not quite right sweetie
child,which car is fastest
parent,you want to know which is fastest
parent,you drew a beautiful horse
parent,i never taught you to talk like that
parent,will you take off her red hat and put on her black hat
parent,you 're a pretty smart cookie
parent,i like the way you made that house
child,this car is red
parent,red
parent,good catch
child,for the baby
parent,turn the dial alright
child,the car is blue
parent,you have a blue car
parent,play nicely
parent,can i get another one
parent,i'm sorry
child,no because the cars are going to eat it
parent,the cars are going to eat it
parent,that 's a lot of blocks
child,i want to color
parent,do you want the blue crayon or the yellow crayon
parent,give me the block
parent,you found a fireman hat
parent,youre going to school
parent,make the tower taller
parent,i like the picture you drew
parent,you 're feeling pleased with yourself
parent,you know all your letters
parent,i want you to add another block
child,i do n't wanna
parent,after we play we can go out for ice cream playing is fun blocks coloring play doh cars are fun
parent,come on and help me build
parent,"yeah , i don t think that one has a splint"
child,i need to use the potty
parent,ok i 'll take you to the potty
parent,so you need to be careful
child,mr potato head is funny
parent,he is funny
parent,awesome job keeping your hands to yourself
parent,that 's a tall tower you made
parent,please hand me a purple marker
parent,let 's sing a song
parent,wait for me
parent,do you really need to act like that
child,team work
parent,team work
parent,do you want to build a house
parent,great
child,i want to build another tower
parent,then you need more blocks
child,look how silly i made my potato head
parent,i love your silly potato head
parent,i like how you kept trying
child,i am going to build a bridge
parent,you have decided to build a bridge
parent,you are singing
parent,this pen does n't work worth a
child,this is a green leaf
parent,it is a green leaf
parent,that was neat
parent,press the button like this
child,the cow says moo
parent,cows do say moo
child,coloring
parent,you colored that purple
child,he has crazy hair
parent,yes crazy hair
parent,roll it out
parent,gesundheit
parent,stop that now
parent,did you hear me
parent,wow that building is tall
parent,you are putting the blue block on the red block
parent,the pieces fit together like this
parent,you drew a pretty flower
child,this present is for koala
parent,i ca n't find mr potato head
child,mommy look at the tower i made
parent,you want me to look at your tower
parent,where do you want me to put the yellow playdough
parent,i do n't like it
child,and another donut
parent,"oh , oh wait"
parent,watch me move my train
parent,stop throwing the crayons
child,i did it by myself
parent,you put on that roof all by yourself
parent,if you do n't stop running around at school i 'll take away tv for a week
parent,do n't put the potato head 's eyes there
parent,you 're sharing
child,i'm going to stand on the chair
parent,i do n't think you should stand on that
parent,you made two stars
parent,we 're gonna play with this one now
parent,that 's one fast train
parent,you are putting away the blocks
parent,are you taking the baby 's temperature
child,nope no way
parent,hey
child,why d you mess
parent,well i had to mess up my food
child,i'm going to play with the
parent,you 've chosen the
parent,you might put the coins in the slot
parent,i'm proud of you for sharing with me
parent,is he the bad guy
child,i want red
parent,you want red again
child,i'm cleaning up fast
parent,i'm happy you 're so fast
child,i want that baby truck
parent,oh let s get the blue one out here
parent,"well , we ll have to wait until we get up for that , okay"
child,the doggy went to teh house to get his mother but his dad came out
parent,that is a good daddy
parent,that is beautiful
parent,but what 's this part
child,child is lining blocks
parent,you lined up the blocks
parent,this dollhouse is attractive
parent,ok
parent,good job coloring inside the lines
child,yep
parent,"well , but then i don t have a pink plate"
parent,"oh , you found a nose and a moustache"
parent,you 're such a good builder
parent,i like how gentle you are being with all of the toys
parent,do n't talk so loudly
child,i'm going to make a cake
parent,you 're making a cake
child,this is red
parent,that is not red
child,kid makes a doll use the toilet
parent,you 're gross
parent,we do n't hit
child,okay
parent,that 's a green apple you are drawing
parent,quit throwing the blocks
parent,will you give me a crayon please
child,i lost a lego at school
parent,you lost a lego at school
parent,what do you want to play
parent,will you hand me the blue block
parent,hmm
parent,i am going to make a pancake
parent,you' re going to pick them up if they fall
parent,well done for putting them away
child,really soon
parent,mmm
child,now all of this is gone
parent,"oh , that disappeared"
parent,do n't be like that
child,the dog is cute
parent,the dog is cute
parent,you put the lion in the house
child,it s really hard
parent,yeah
parent,you are really good at this
child,she threw up today
parent,you know your numbers
parent,awesome choice to start with legos
parent,i wonder how it goes on
child,boing
parent,uh oh
parent,one more hole
parent,do you like mr
parent,do you want to help me clean up
parent,can you hand me the marker
parent,i found the missing piece
parent,you are building a tall tower
parent,i love your drawings
parent,i love how you put the train track together by yourself
parent,there are four green crayons
child,i ll put some spices for my food
parent,ok
child,that look like a porch
parent,you are looking at the picture book
parent,that does n't belong there
parent,we must put the roof on
parent,are you using blue now
parent,that s pretty awesome
child,i made a flower
parent,you did such a great job of drawing that flower it is beautiful
parent,look here
parent,i 'd like to comb your hair
parent,cool idea
child,(child pretends to eat cake) munch munch
parent,munch munch munch
child,i like
parent,you like
child,i like special time
parent,you like special time
child,he sees the house is on fire
parent,the house is on fire
child,i put her red dress on her
parent,oh the red dress
parent,that better
parent,come on really
parent,i think those are peas
parent,which one do you want to play with
child,this one is nemo
parent,yes it is nemo
child,eat that spicy things
parent,"you have spicy french fries , and you have spicy pizza , and"
child,we live in em and watch the show
parent,you have got to
child,(child stacking blocks)
parent,you 're stacking blocks
parent,good job staying in your chair
child,why
parent,it looks like a flower
child,ill be right back
parent,can you
parent,hmmmm
parent,that 's not how it goes
parent,do n't open the other container
parent,what s your favorite color henry
parent,i love how safe you are being
parent,you 're not very good at building
child,this is the mommy doll
parent,that is the mommy
parent,not like that
parent,do you want this
parent,you are flying the plane
parent,that 's a red one right
parent,another hat
parent,will you tell me what time it is
parent,you did a good job and now you can play cars
child,i found a green
parent,a green
child,do n't look at me
parent,ok i wo n't look at you
parent,you made it go down the ramp last time
child,up
parent,you have the blue crayon
parent,what were you making
child,i made mr potato head
parent,you did make mr potato head
child,that grass is going to be green
parent,green
child,i drew a dog
parent,you drew a dog with big ears
parent,nice job cutting safely with the scissors
child,sissy 's a show off
parent,that 's not nice to say
parent,you found the horse
parent,give that back
child,but we need a lot more tea pots
parent,i ve got a little pink tea cup
parent,high five for knowing your numbers
parent,you made me a delicious cake
parent,we 're going to play with this toy now
parent,"well , that s a whole box of trucks , isn t it"
parent,that was a stupid thing to do
parent,what should we do next
parent,i need to pull up my chair
parent,you 're driving to the store
parent,look
parent,look at this one
parent,you added a tile
parent,great helping
parent,please clean these toys up
parent,how many blocks are here
parent,the tinker toys should be picked up now
parent,i 'd like you to finish the picture
parent,your car is so much faster than mine
child,she goes in there
parent,in there
parent,that s right
parent,be careful
parent,you figured out how to put those pieces together
child,potato head
parent,that s our third mr
child,the tank is
parent,i think we just have an ambulance
child,whose turn is it
parent,whose turn is it
parent,thank you for making me this beautiful picture
child,yeah its better
parent,your tower is going to crooked
child,with syrup on it
parent,syrup
parent,put the red block on the blue block
child,look mom an elephant
parent,elephants can grow to be very tall and big
child,the child says he 's done playing
parent,that 's it
parent,you put him to toilet
child,i'm drawing the sun
parent,there are lots of things in the sky
parent,i want you to sit over here by me
parent,thank you for giving me the donut
parent,you are fixing the plane
parent,you 're not being very nice right now
parent,that was a great idea to put the block there
parent,quit throwing the toys
parent,do you got some do you see some long ones like this it s got 1 2 3 4
parent,do n't go in my purse
parent,no this crayon is blue
parent,i like how you put them all that way
child,that 's a funny clown
parent,you think he 's funny
parent,thank you for the block
parent,but you got three
parent,can i try
parent,can i play with your car
parent,you 're a fast writer
parent,you are looking for another piece
child,i do n't like this game
parent,you do like this game
parent,put the blocks away before you play with something else
