Speaker,Utterance
parent,yeah
parent,the cow is jumping
parent,good choice to play with legos
parent,give me that one
parent,we went to the park yesterday
child,give me the blue one
parent,the blue one is broken
child,what is that thing in your ear
parent,you want to know what this is (pointing)
parent,put this over there
child,this tower is really big
parent,the tower is huge
parent,you 're playing nicely and quietly
parent,the door is shut
parent,now you 're using the small blocks on your tower
child,i do n't want to pick up the toys
parent,children are supposed to pick up their toys
child,another
parent,oh yeah
parent,the car is racing around the table
parent,you never listen
child,look at it
parent,you do n't put the legos together like that
child,shrimp that you
parent,you need to take the long stick
parent,you are digging through the bin
parent,maybe i ll just start all over
parent,hooray you rock
parent,i'm using red okay
child,i m watching tv
parent,"oh , what s he doing up there"
parent,please hand me the block
parent,tell me how many blocks you have
child,"no , i am"
parent,i am
parent,really (sarcastic tone)
parent,the animals are playing
child,i have a blue block
parent,you have a blue block
parent,i wonder if this goes together
child,i'm going to make a castle
parent,you 're making a castle
parent,you put the block back in the bin
parent,great memory
parent,you found a
parent,you 're not a good builder
parent,you 're not playing with that
parent,what do you want to play with now
child,will you help me
parent,you do it
parent,that was good thinking
parent,put an a here
child,i'm building a big one
parent,you are building a big one
child,climbing on the chair
parent,you are climbing onto the chair
child,i like to come here
parent,i'm happy that you like to come here
child,i see the ladybugs outside
parent,was not that exciting
parent,you 're stupid
child,naima folding rags
parent,what did i tell you about namecalling
parent,it 's great
parent,stop playing so loudly
parent,why do n't you clean up like this at home
parent,thank you for using your manners
parent,keep putting those away
parent,focus on what you are doing
child,i have a napkin for corny d
parent,is this the one you want
child,i have a
parent,you have a
parent,i see you 're tying those together
parent,it sure has been hot out there
parent,when we 're done you can put the crayons away
parent,you are picking up a big handful of toys
parent,i love how gently you 're playing with the toys
parent,house
parent,that 's not where it goes
parent,we should n't be using so much paper
parent,you are getting out the food
parent,let 's go to the cars
parent,what time is it
parent,whoops
parent,i wonder if i can find some eyes to match this hat
child,this is an a
parent,a
parent,the blocks fell down
parent,can you make a cat sound now
parent,you put wheels on the car
child,the train goes fast
parent,keep the train on the floor please
child,the horse has a fever and needs medicine
parent,that 's not a horse it 's a goat
parent,"it s trying to , maybe it s supposed to hold something"
child,today we had recess too
parent,here is the piece
child,i am being a horse
parent,horse
parent,you put the girl in the bed
parent,you 're stacking the blocks
child,i m alright
parent,oh
parent,this is a really big tower
parent,what sound does the horse make
parent,you have to follow my rules now
child,cool
parent,that is cool
parent,good job using your inside voice
child,yes
parent,eat it
parent,i'm making a ship
child,child puts lid on backwards to a container
parent,that does n't go that way
parent,you are so nice
child,we can pretend there it is
parent,okay
child,child is playing quietly
parent,thank you so much for playing so quietly in your chair
child,that s good
parent,i like how you said please
child,hi doggie
parent,i wish this tower was bigger
parent,hi five
parent,i ll pretend the firetruck that s the firehouse
parent,will you let me help you
parent,we 're going to the store after we leave
parent,look what i made
parent,this is a plane
parent,you are so cute
parent,little baby truck
parent,that 'll be the day
parent,you are using the green crayon
child,child coloring
parent,you 're coloring anna
parent,you have to push it forward
child,where does this go
parent,anywhere
parent,your tower is the best i 've ever seen
parent,you sent the car down the ramp
child,can i have the marbles
parent,you 're wondering if you can have the marbles
child,right
parent,you might
child,not yet
parent,not yet
parent,don t eat it
parent,should we play with the blocks now
child,the elevator goes up
parent,up
parent,i am going to color
child,put it on
parent,that one
parent,you are coloring with the crayon
parent,you made a boat but you need to draw a rudder
parent,can you open it
parent,you should n't get another toy out until this is cleaned up
parent,mommy is wearing a red shirt just like you
parent,you know not to do it that way
parent,uh oh
parent,spit that out or i 'll spank you
parent,why do you put it there
child,the cars are going to race
parent,the cars are going to race
parent,your potato head needs some arms
parent,you drew a flower
parent,why do n't we clean up
parent,you 're unloading your cargo
parent,you should have put it there
parent,i like the way you did that
child,with
parent,with
parent,what a sweetheart you are for sharing
parent,i love the tower you built
parent,they have fun toys here
parent,it would be cool to put the red nose on him
parent,you 're so quiet today
parent,the tower is getting so big
parent,oh
parent,if you do n't pinch we 'll have more time to play
child,i fell off the tree and cried
parent,i need to tell grandma she should n't let you climb up there
parent,aiming right at the bullseye
parent,you 're putting on the green triangle
child,and carrots
parent,how about a banana
parent,you are playing with the cars
parent,i love the colors you used on your house
parent,and draw a pretty flower
child,huh
parent,you are so creative when you play with blocks
parent,it 's great how nicely you 're playing with the toys
child,yeah
parent,yeah
parent,do n't
parent,ca n't you just fit it in there
parent,you 're trying so hard
parent,hey thanks for sharing
parent,"now pause do you think if we made another wall right beside it , them trucks will drive over it"
parent,you are the best
parent,you found so many cars
parent,if you throw any of these crayons i 'll put you in time out
parent,stop screaming
child,he just ate it again
parent,"yeah , there s the ice cream place right over there"
parent,let 's clean up now
parent,why do n't we play with the kitchen
parent,inside the house
parent,watch it buddy
child,child playing with play doh
parent,you 're making pancakes with the play doh
parent,do you want to play with the potato head
parent,you 're playing animals
child,and the other wheel was broken
parent,two broken wheels on one car
child,come on
parent,you are my little helper for putting the toys away
parent,come here and play with me
parent,can you please be quiet
parent,careful
child,yeah
parent,oh
parent,i appreciate you bringing me my purse
child,inaudible
parent,"oh , that s great"
parent,you have the truck
parent,you 're playing good
parent,you sat down
parent,put the gun in the toy box now or there will be no ice cream on the way home
child,where 's daddy
parent,i think he 's in the bathroom
child,we made a mess of this room
parent,we did make a mess of it
child,it 's a donkey
parent,a donkey
child,i like trains
parent,you do like trains
child,shows drawing
parent,that 's great
parent,this ear piece is for grown ups
child,that put on that
parent,"oh , now you re gonna put another one"
parent,how tall will it be
child,these are hard to put together
parent,definitely pretty tricky
child,you eat some
parent,"oh , it s so heavy"
parent,the dog is walking in the grass
child,yeah
parent,who s the meanest car
parent,put that one away
child,i have a yellow block
parent,you do have a yellow block
parent,you made a blue star there
parent,you got lots of crayons in your pile
parent,that 's not how you make a tower
child,i made a tower
parent,you made a tall tower
child,uhhuh
parent,you are so good at stacking the blocks
parent,spider man is a superhero
parent,you 're pretty cheerful today
parent,what 's the clown 's name
child,i'm scared to make it higher
parent,you 're scared
child,i do n't like you
parent,i do n't like you either
parent,do n't throw them in the box
parent,i like playing blocks
parent,thanks buddy
parent,"now , i can wave at you"
parent,you are making a big house
child,you messed it up
parent,what do i always tell you
parent,amazing job
parent,you 're feeding the cow
parent,i love the airplane you made for me
parent,it 's my turn
parent,one two three four five
parent,that is the color purple
parent,this is really hard
parent,come over here with me
parent,i love the way you are playing so gently
parent,there are a lot of toys in here
parent,you did stack the blocks
parent,you want to color
parent,how was your day at school
child,i want all the toys
parent,what a fun toy
parent,i 'll buy you new markers if you draw with these now
parent,oh my goodness
parent,that s a great job
child,can we go to mcdonald 's after this
parent,have n't i heard that before
parent,you got the green car
parent,haha i get to play what i want and you ca n't
child,potato head has three arms
parent,your potato head does have three arms
child,i'm building an ugly fence
parent,you 're building a fence
parent,you put the blue block on the red block
parent,stop being so bossy
child,"look , this car is gonna come"
parent,they are loving it
parent,come race with me
parent,you 're so thoughtful
parent,"wow , what did you put in here"
child,"one more , one more"
parent,put this there a little bit
parent,you got out the cars
child,carl look
parent,you are handing me the stick
child,four
parent,four
parent,over there
parent,that 's crooked
parent,can you put your jacket on
parent,help me clean up the toys
parent,why do n't you want to play with me
parent,you 're putting out all of the dishes for lunch
parent,blue is your favorite
parent,what do we do with this
parent,good one
child,another pizza flavored cupcake
parent,another one
parent,you made it move
child,what is this
parent,that looks like a moat to me
parent,we had that at grandma 's before
parent,you found a one piece
parent,if you put it there it might fall
parent,an edifice
parent,you remembered your jacket
parent,good job naming your colors
parent,thanks for sharing
child,put back up there
parent,the sky is blue
parent,do you want me to play too
parent,what letter is this
parent,put that block here
parent,make an e
parent,why do n't you put the bus in the box
parent,good job getting that one on there
child,and i will take the cakes
parent,you ll take the cakes
child,i want to play with the blocks
parent,you want to play with the blocks
parent,stop touching that
child,this is new chalk
parent,that is so great
parent,please put the man in the truck
child,whoa
parent,whoa
parent,close the box
parent,i ll choose this one
child,it 's sunny in my picture
parent,it 's raining outside
child,get em fixed
parent,"oh , i ll put them all up here again to get them ready to go down"
child,sleepy bears
parent,you can
child,i'm drawing a skeedle bee
parent,what is a skeedle bee
child,child pushing train and says choo choo
parent,choo choo
parent,you know to match the shapes
parent,let me see what you 're doing
parent,you messed up the picture
child,the cows going back to the barn
parent,back to the barn
parent,is n't that a pretty dolly
parent,are you going to put him in the dungeon
parent,that 's a cow
child,buzz buzz whoosh
parent,buzz whoosh
parent,you did a great job building that tower
parent,do you like the farm
parent,great job sharing the ball
parent,what color is this one
parent,you 're pushing the truck
parent,that is so cool
parent,building the wall
child,oh yeah the eves too
parent,we went to the store yesterday
parent,is n't that a lovely design you made
parent,you are trying to decide where to put it
parent,you will have a colorful sky
parent,you made it fly
child,draws picture
parent,beautiful
child,i need a red one next
parent,you need a red
child,potato head
parent,you put his hat on
parent,i love when you use your manners
child,yeah for a cereal
parent,you want it to be safe
parent,"to build another wall we got to get the floor , the foundation down now"
child,this can be a helicopter
parent,you are so creative
parent,awesome putting stuff away
parent,ah ah
parent,it does n't go that way
parent,now give me that one
parent,excellent
child,this is going to be a house for the horses
parent,that 's going to be a house for the horses (rising inflection)
child,i chose i chose the what s that
parent,that is a tray
child,whee
parent,whoa
child,yeah
parent,"oh , it s a fancy christmas shirt"
parent,hand in that block
child,all these blocks are going to be a tower
parent,so you want the blocks to make a tower
parent,put that one over here
child,i goin water over dere
parent,i'm not sure if you put it there
parent,but you need to finish it
child,which one is the zebra
parent,the zebra
parent,what color are you going to use
parent,you turned him into a robot
child,where 's the blue piece
parent,the blue
parent,that is a pretty house
parent,you 're pushing it along the floor are n't you
child,legos
parent,i am going to build something fun
parent,please hand me the apple
parent,you should put his nose on
parent,i put thing here
parent,you 're daddy 's little helper
parent,you lined up your animals
parent,you 're building a tall tower
child,i want to play something else
parent,you want to play something
parent,you can use this big blue lego for that
child,let s not go
parent,no
parent,awesome job
parent,how should we do it
parent,give me more short ones
child,i made a tower
parent,tower
parent,i said put the toys away
parent,there are a lot of toys on the table
parent,you put the red dress on her
parent,i want you to sit here
parent,we can do that later
parent,you put that the wrong way
parent,really really cool
parent,now why 'd you do that
parent,i want a block on the top
parent,gtreat work
parent,french fries sandwich
parent,and then can i have this one
child,sometimes i put hats on
parent,sometimes you put hats on
child,this one does not fit
parent,it doesn t fit
child,you play with the tractor
parent,you want me to play with the tractor
parent,all right
child,right
parent,alright
parent,why why why
parent,what 's this
child,ahh
parent,here comes my yellow car
child,here you go
parent,can i have some
parent,you 're driving the train over the bridge
parent,that is a car
parent,"oh , you re putting the arm in mr"
parent,that is not the way we act
parent,thank you
parent,no that 's not right
parent,oh my goodness
parent,that 's not a square
parent,what 's this guy 's name
parent,sit still
parent,this is a fun toy
parent,you 're going to draw his hat bright red
parent,fig newton flavored cupcakes
parent,how many times do i have to tell you
child,uhhuh mine okay
parent,that fence is broken
parent,that 's enough
parent,this is a two piece
parent,that piece does n't go that way
child,they 're curly
parent,they are curly
child,this block is blue
parent,this block is blue
parent,put that down
parent,he did say that
parent,you want to fix the plane
parent,perfect job getting the puzzle pieces in just the right spots
parent,that s pizza
parent,you 're going to break it be careful
parent,just pretend
child,this one \( points \)
parent,the iron man
child,i ll have some chocolate
parent,"oh , you have a drive through chocolate place"
parent,let s get some long ones here
child,this is a green crayon
parent,that is a green crayon
child,"we like to eat pizza dough , right"
parent,"yeah , you re right"
parent,would n't that be fun
parent,wait until your father hears about this
child,excuse me
parent,you 're polite
parent,i said put your feet on the floor
parent,you 're smart
child,blue is my favorite color
parent,you like blue the best
parent,good choice of the cars
parent,are you sure you want to put that there
child,the mommy and the daddy and the sister are eating dinner
parent,the whole family is eating dinner
parent,go to the table
child,the cow says moo
parent,you are making the cow say moo
child,he 's got a thingy on his head does n't he
parent,a thingy yes
parent,great job building that castle
parent,i never even knew that
child,i'm making you a drink
parent,you 're making me a drink
parent,that s a good idealabelled_praise
child,please
parent,shut it
child,\( points \)
parent,"oh okay , let s get all these trucks over here"
parent,uh
parent,you do n't ever listen to me
parent,you have the crayon
parent,that 's a
child,i made a big square
parent,you made a big square in the circle
parent,let 's put one right here
parent,you 're putting the corner piece on
parent,i need you to stop
child,should i use the blue or the black
parent,you tell me which one you want
child,i found olaf
parent,you did find him
parent,can you count the animals
child,you 're building a high tower
parent,i'm building a high tower
parent,why do n't we clean up these blocks before we get another toy out
parent,color this one yellow alright
parent,"you wanted it oh violet , that looks awesome"
parent,i like the castle you built
parent,do n't put that toy in your mouth
child,they are going to a party
parent,oooh a party
child,told you
parent,sit over there
parent,you place at wrong place do n't you
parent,what do you say to (insert therapist name)
parent,do n't put it there
child,uh
parent,do you want to sit down
child,there
parent,i like the way you are sitting down
parent,could we sit at the table
parent,which toys do you want to play with
child,i'm sleepy
parent,you are n't getting enough sleep
parent,are you going to play with me
child,she has a doll
parent,we went to the store yesterday and you got a doll
child,found one
parent,oh my goodness there s a whole bunch of them there
parent,come sit with me
parent,how cool
parent,what are you making over there
child,i know you can do it
parent,"oh , i think i m going to place the cars in here"
parent,what color is this
parent,here you go
parent,you still got room for one more
child,playing with a truck
parent,the truck is going up the ramp
child,i'm going to draw next
parent,you 're going to draw next
parent,close the door please
child,look at my cat
parent,that 's not a cat silly
parent,what color is that door
parent,if you keep doing such a good job we can get a soda later
parent,i'm gonna make a house
parent,pass me the toys
parent,can you build a tower here
parent,alright
parent,"no , you re supposed to flip with it"
parent,you 're looking for the red ears
parent,hand me the purple crayon
parent,red then green
parent,that 's not nice to take her paper and her crayons
parent,this is a terrific house we made
child,i like the cars
parent,you like the cars
parent,you do n't want to
parent,oh cool it makes music
child,in front of this one
parent,"yeah , now what happens"
parent,what should i do
parent,it 's nice how quietly you 're playing with the blocks
parent,mommy is going to put away the toys now
child,the minister told us a story
parent,the story was a bible story
parent,you are staying inside the lines when you color
parent,wo n't you make a cat sound now
parent,i like how you re trying all of the different cars and seeing how fast each one goes
parent,do you want to have a race
parent,you 're acting nicely
parent,alright
child,i'm mad at you
parent,you 're mad at me
child,that 's a house for maggie
parent,for maggie
parent,pick up the toys okay
parent,but now you added a green piece
parent,pick up the play doh off the carpet
parent,i like that drawing
parent,i'm taking my animal to the store
parent,i'm coloring like you are coloring
parent,that 's the cow
child,i hate you
parent,you ca n't do this
parent,i like that you 're not climbing on the table
parent,who taught you how to do that
parent,if you stop biting your nails they 'll be prettier
parent,where do you want the fence to go
parent,he won t have a cupcake
child,im a cookie monster and a milk monster and a yogurt monster and a
parent,the cow is brown
parent,hey hey
parent,children are n't supposed to yell when they 're inside
parent,you 're coloring the house with green
child,hand me the nose
parent,i 'll hand you the nose
parent,these pages are dirty
parent,thank you for picking up all the toys
child,i made a train track
parent,i love your track
parent,what 's going on here
parent,you got them together
child,dad the bus driver yelled at me again today
parent,he was n't very nice to you
parent,you 're making us dinner
child,i should put her clothess on
parent,you counted the numbers perfectly
parent,if you do n't give me the yellow crayon you 'll have to sit on the time out chair
parent,do n't do it like that
child,come sit with me
parent,you want me to come sit with you
parent,that was awesome
parent,you 're making that tower so tall
parent,you know what
parent,nice job with that tower
parent,these are peas
parent,that is not how we do things
parent,that wonderful tower you 're building may crash if you put it so close to the edge
child,why are we here
parent,why do you think we 're here
parent,are you making a tall tower
parent,thank you for sharing with me
child,i want to play with the train set
parent,you want to play with the train set
child,that small
parent,"that one is kind of low isn t it , we need a tall one don t we"
parent,you are going to make the windows red
child,"like that , like that"
parent,"oh there see , you got it out"
parent,name of child
parent,you drew a purple flower
parent,we need to put another log right here
child,this is a dog
parent,yes a dog
child,(child is playing with toy farm)
parent,the farmer is taking care of his animals
parent,that 's perfect
parent,good girl for playing
child,i dropped it
parent,oh that 's great
child,what is this (holding up a dolphin)
parent,that is a dolphin
parent,these pegs go in these holes
parent,you have the block
parent,do we sit on the table
child,i put it on top
parent,you did put it on top
parent,i 've noticed you 're really working on that tower
parent,ok
child,i'm going to share my straws with amy
parent,you share your straws with your friend
child,i love animals
parent,i am going to play with the farm
child,we need to find the bad guy
parent,okay i 'll help you find the bad guy
parent,you are awesome
parent,are you sure you want to do that
parent,good job sharing that toy with me
parent,why are you doing that
child,i want to play this
parent,you want to play this
child,let 's play with legos
parent,legos
parent,you are playing with the rocket
child,that
parent,where is mexico
parent,"oh , good job"
child,i am drawing a horse
parent,you are drawing a horse
child,how does it work
parent,i do n't know how it works
parent,you 're drawing a tree
parent,wait up
child,i like the horse
parent,you like the horse
parent,awesome job being quiet
child,it 's a big house
parent,it is a big house
child,you have to put it the other way
parent,like this right
parent,what a pretty flower
child,i ll choose this one and this one
parent,"oh , you got two"
parent,how many wheels are there in this car
child,there 's a green one
parent,yes there 's a green one
child,uhhuh
parent,i see you are coloring those apples pink
parent,i want you to make me a pizza
parent,put that here
parent,you are putting the green block on the yellow block
parent,that 's a messy picture
child,okay
parent,is it this one or that one
child,see the kitty
parent,yeahkitty
child,stacking legos
parent,you are stacking the legos
parent,you colored nicely
parent,you 're adding the piece there huh
parent,i think i need a hat
child,i have four horses
parent,you have four horses
child,i like this one
parent,you like that one
parent,good job keeping your hands to yourself
parent,put the chimney on
parent,give me the hammer or you ca n't play computer games when we get home
child,i'm cleaning up
parent,you 're cleaning up
parent,you are putting the arm in mr potato head
child,mine won again
parent,yours won again
child,i'm gonna open the door
parent,now you 're going to open the door
child,these cars are getting ready to race
parent,ready to race
parent,you build a really cool tower
parent,my favorite cake is strawberry
parent,i love how you 're using such kind words while playing with me
parent,thank you
parent,you 're smart for knowing your colors
child,can we go to macdonald 's after this
parent,no you did n't earn macdonald 's
parent,whatcha got there huh
parent,thank you
parent,jimmy give me the rock
child,i found a lego
parent,you did find a lego
child,let 's play with the blocks now
parent,i will get the blocks out
child,we have pizza grapes and a cookie
parent,pizza grapes and a cookie
parent,is that his left arm
parent,what is it anyway
child,i can make build this really high
parent,you can build it high
parent,pay attention
parent,i see
parent,i m using the red car
parent,i hate your whining
parent,now we got to get a single block like the little yellow one an then we got to put these together then we put
parent,it 's almost time for grandma 's visit
parent,they are eating
child,you re just kidding
parent,yeah
parent,i like playing with you
parent,you 're getting out the magnets
child,child puts cap on a marker
parent,you put the cap on the marker
parent,super fort
parent,you 're working hard to build the barn for all the animals
parent,put the crayons in the box
child,it 's almost time for a break
parent,it is almost time
child,i ll keep using pinks until we run out
parent,pink is your favorite
parent,i see
parent,that does n't go like that
child,(child climbs on chair)
parent,not available
parent,your making a talk tower
parent,i like how you made that tower
parent,you are doing a great job stacking those together
