Speaker,Utterance
parent,i need to sit closer so i can see this
parent,awesome job fitting that piece on there
parent,let 's not do that yet
parent,"ah , thanks"
parent,you put the green one on top
child,here 's a strawberry mommy
parent,i do n't like green strawberries eww (again play doh)
child,fox
parent,i'm hungry
child,race with me
parent,okay race
parent,how about if i put this block on your tower
child,because he was want to
parent,when we are done you can put the crayons away
child,but the playdoh is for the girls
parent,the playdoh
parent,you 're turning the train
child,i like orange the best
parent,orange is your favorite color
child,"but all these cars are just like , they wanna go that way"
parent,good idea to get them down there
child,i'm making a boat and a jet ski
parent,you 're making a jet ski
parent,i think these toys are cool
child,monster trucks
parent,monster trucks
child,i do n't want to pick up the toys
parent,children are n't supposed to complain
parent,your grandmother drives a red car
parent,what a fantastic house you drew
parent,that 's great hunny
parent,thanks for the drink
child,there should be a princess with the castle
parent,you 're mistaken
parent,i want you to make me a milkshake
parent,you are walking very close to the edge
child,where does this go
parent,how about over there
child,trap
parent,it is nice how quietly you are playing with the blocks
parent,"oh , i forgot a can and a cutting board"
parent,what should i do now
parent,and those
parent,should i help you put the train track together
parent,take your jacket off
parent,thank you for giving me that
child,undressed
parent,you are working to make it darker
child,pizza flavored cupcake
parent,a pizza flavored cupcake
parent,thanks for picking it up
child,that one too
parent,and that one
parent,stop being a baby
parent,dont do that
parent,you are so smart
child,nobody
parent,ca not you just fit it in there
child,no
parent,no
parent,help me make this castle
parent,that 's not a ( cow) that 's a (pig)
parent,that one 's red
child,which one is the zebra
parent,which one is it
parent,you did great putting his hand in
child,i want to be the best fighter in kindergarten
parent,if you do n't hit people will like you better
parent,you smell like soap
parent,why you always put toy into your mouth
child,child making a potato head
parent,awesome potato head
parent,stop kicking
parent,you 're about to fall
parent,here comes this one
child,"yeah , and since all these cars are going to eat that food"
parent,ok
parent,do you want to play with this one
parent,you made a picture
child,let 's build a tower
parent,build a tower
parent,thank you for handing me the crayon right away
parent,now you are putting the red block in the box
parent,if you throw that you will not get it back
parent,how about if you put this block on next
child,he called in the firemen
parent,skywalker called in the firemen
parent,you made him stand up
parent,are you building a house
child,keep that out
parent,you are setting up the legos
parent,how does this thing work
parent,you drew a picture
parent,hey sweetheart
child,dogs are cute
parent,do you think my dog is cute
parent,oh i like that bug
parent,i like your picture
parent,what should we do
child,yeah
parent,then we can put some stuff on our tray
parent,you picked up the green hat
parent,that 's the blue crayon
parent,can you please be gentle with the toys
parent,does that make sense
parent,you found a rocket ship
parent,i'm going to put this hat on my mr potato head
parent,thank you
child,those don t fit you
parent,they don t fit me
child,i want to build
parent,you want to build
parent,are you planning to use that
parent,put it down or else
parent,i hate you
parent,we ca n't do that in here
parent,the mommy doll is holding the baby doll
parent,thanks for handing that to me
parent,and a firetruck
child,it 's a race (child puts toys away swiftly)
parent,you 're cleaning up really fast
child,is this as good as johnny 's
parent,you ca n't help not being as smart as your brother
parent,can you do this one
parent,let 's draw a picture
parent,not like that honey
child,i ca n't find the piece
parent,do you know what i think
parent,do n't scribble
parent,do you want to play with the cars now
child,i am going to put the people inside the house
parent,you are going to put the people inside the house
child,i made it pretty
parent,you did
parent,i'm going to play too
child,i want this
parent,sure
parent,okay
child,(inaudible)
parent,what did you say
parent,you found the red cars
parent,should i make the rabbit out of yellow now
child,the hard ones i'm going to do tomorrow
parent,you are going to do the hard ones now
parent,just stop it
parent,in the toy box
parent,you 're drawing coloring the leaves
parent,can we do that
parent,that was really slow the way you copied it
parent,that was pretty dumb
parent,that is a blue crayon
parent,daddy likes to play with legos too
parent,where do you think this piece goes
parent,i like you clean up toy
parent,you put the toys away all by yourself
parent,that 's not what that is
parent,we ve got four cars left to put in
parent,you gave mr potato three arms
parent,stay in your seat
child,i think you should take it off now
parent,you would like me to take it out now
parent,let 's make the tower taller
parent,almost done okay
parent,you did n't put her eyes on under those glasses
child,i love unicorns
parent,unicorns
parent,how about picking up the toys over there
parent,your eyes are pretty
parent,you are moving the train into the station
parent,nice one
parent,you 're knocking stuff over
parent,i like how you are playing so nicely
parent,sit
parent,the car goes vroom vroom
child,blue block
parent,that is a blue block
parent,what color is that
parent,that color is red
child,that is a puppy
parent,that is a puppy
parent,i m going to put them in gently
parent,i love this game
child,i like this hat
parent,you have a hat
parent,i wonder what you 're making
parent,you made it fit
parent,yellow is my favorite color
child,will you play with me
parent,o k
parent,i need more pieces for the track
parent,ok
parent,what are we going to play
child,my valentine is going to be for you
parent,you 're making a valentine for me
parent,you remember how we did this
parent,stop coloring on my paper
parent,you 're putting all of the blocks in a row
child,and we re also having another donut for both of us
parent,"oh , another donut for us to share"
parent,you drew a big fluffy cat
child,what color yours
parent,that sounds like a dog
child,cars
parent,cars
parent,where is that guy going
parent,you 're driving the car fast
parent,you are sitting on the floor
child,uh
parent,you want one of those
parent,great job figuring that out
parent,this one 's about to take off
parent,i love coloring with you
child,i am happy playing with you
parent,you are happy playing with me
child,i want that toy
parent,you want this toy
parent,which one is coming next to the picnic
parent,get down now
parent,i like coloring
parent,do you think it will break then
parent,now i think i ve got it all
child,i tried that already
parent,i ll try
child,i like pizza
parent,you like pizza
parent,i 've noticed you are really working today
child,i'm making the tallest tower in the world
parent,the tallest
parent,great job (sarcastic)
parent,can you stop that
child,this is a big cow
parent,yes it is a big cow
child,i love playing with you
parent,you do love playing
parent,what does a cow say
child,why
parent,put these kind on for me
child,child coloring
parent,you 're using orange
parent,you are driving the blue car
parent,i think it will make it sweet
parent,that 's smart
parent,you got anymore out
parent,do you understand
child,we made a mess of this room
parent,we made a mess of it did n't we
parent,you 're being naughty
parent,here comes this one
child,this is going to be his friend
parent,his friend
parent,can you please clean up
parent,it is cool
parent,oh no no no
child,it 's a green
parent,yep that 's a green crayon
child,winnie the pooh is going to walk to piglet 's house
parent,winnie the pooh is walking to piglet 's house
child,i want to
parent,can you put the red stick on top
parent,you cleared that off
child,i gotta pee
parent,pee time
parent,please pick up the legos
child,verooooooom
parent,veroooooom
parent,i'm not sure what to do with this
parent,if you keep pinching at school you 'll be grounded for a week
child,can i color the spaceship silver
parent,you may color it silver
child,can we go down this hallway
parent,you 'll beg for candy if we pass the vending machines
parent,we are figuring it out together
parent,put that on there
parent,we have three minutes left of play time
parent,how wonderful
child,here 's ernie he 's fixing the car
parent,that 's ernie
parent,you got it
parent,you 're being bad
parent,we do n't do that
child,your hans cold
parent,you put the dog in the house
parent,you 're so creative
parent,smart
child,he 's got a thingy on his head does n't he
parent,a thingy
child,i m really good at throwing
parent,thank you for putting the cars in the box gently
child,i want lots of balloons at my party
parent,you want lots of balloons because they 're fun to pop
parent,your being silly
parent,i do n't want you to do that again
child,salsa
parent,her elf s name is not salsa
child,123
parent,123
child,you don t fill this whole bottom part up this time
parent,right
parent,you are going to get down
parent,i don t remember the green one
parent,you knew right where to put that one
child,but when her mother turned when rapunzel s haired turns brown
parent,yeah
child,i want to play with the playdough
parent,you want to play with the playdough
child,i'm pushing the car so fast
parent,so fast
parent,you are looking for something
child,follow me
parent,should we race
child,whoa
parent,oops
parent,you picked up a magnet
parent,what was it you said
parent,please hand me a piece of paper
parent,there are lots of horses in here
parent,do you need my help
child,huh huh
parent,can i see that
child,kid makes farting noise
parent,that 's nasty
parent,no that 's not blue
child,colored
parent,you made a beautiful picture
child,i have a car
parent,a car
parent,you want this
parent,stop talking so loud
child,eh dis is eh row row your boat
parent,what happened at school today
parent,stop playing so rough
child,this car is fast
parent,the car is fast
child,let 's pretend we 're unicorns
parent,you have a wonderful imagination
parent,you 're putting cookies in the oven
parent,wow putting more blocks on
parent,maybe
parent,that s not very nice
parent,i like it when you play nicely
parent,be careful that marker cap is not on correctly
parent,you put legs on your potato head
parent,good job sitting
parent,i'm gonna be the daddy
parent,gives a high five
parent,stop throwing
child,i am making coffee for you
parent,you are making coffee for me
parent,do n't be so rough
child,i'm going to shoot you
parent,we do n't shoot things
parent,is n't that a colorful clown
parent,thank you for cleaning up
child,you can choose seven
parent,"ok , thanks"
parent,we need to draw flowers here
child,why do people haveto pet little dogs
parent,you 're drawing a sun
parent,is n't this a great game
parent,do you want the red ones green ones or blue ones
parent,the car fell off the table
parent,what letter does car start with
parent,you go
parent,how about if i use the green crayon
child,okay
parent,your father will be impressed when i tell him how fast you cleaned up today
child,we re gonna use it for the next picnic
parent,"we ll need it for the next one , alright"
child,where 's the therapist (name of therapist)
parent,the therapist (he or she) is in the other room
parent,"oh , you found some eyes to match the hat"
child,he threw his television out without asking his mommy
parent,children should use their quiet voice inside
parent,that 's a red car you 're touching
parent,you just drew a sunflower
child,i'm hungry
parent,you 're hungry oh yeah i can hear your stomach growling
child,gives parent a block
parent,you just shared your toy that was sweet
parent,you 're using a lot of orange
parent,put his arm right here
parent,you made an awesome train track
child,this is the biggest tower we 've ever built
parent,it is a really big tower
parent,you are not allowed to run in here
parent,are you drawing our house
parent,you 're putting the puzzle piece in the wrong spot
parent,where do you want this block
child,help me
parent,you want help
parent,you put the red dress on the doll
child,"now you have one , two , three , four , five , six"
parent,and how many do you have
parent,that one doesn t go there
parent,i have a plate for it
parent,i'm building it really high
parent,you picked it up
parent,help me
parent,now you do it
parent,you know better
parent,mommy is drawing
child,that is the lellow sun
parent,that is not how you say it say yellow
parent,please color elmo green
child,i'm having fun
parent,you are
child,somebody jumpy jumpy tail
parent,you are a good builder
parent,no no not like that
child,i'm bored
parent,your bored
parent,i like these blocks
parent,just try
child,this is hard
parent,this is so hard
child,"um , i was making a feast"
parent,"you were making a feast , got it"
parent,oh i see what you 're doing
child,i dont want it
parent,do n't leave the room
parent,are you sure
parent,here i come to get some cake
parent,no you have to follow my rules
child,oh thank you
parent,oh
parent,that valentine you made is really special
child,four
parent,sit down
child,potato and mr potato head
parent,"oh , so the picnic will be for the potato heads"
parent,i wish i had the potato head
parent,look at these cool toys
parent,you are sitting in the chair
child,this is for you
parent,this one is for me
child,uhuh
parent,that is a good tower
parent,let 's color
child,i like the blue one the best
parent,the blue one
child,i wanna do it
parent,grab the piece from there
parent,look at you
parent,you 're being really bad right now
parent,you forgot to pick up the food
parent,the easter bunny is going to love this basket
child,i think the doggy is sick
parent,he is
child,so maybe we don t have to but i was thinking of making it look like a real house
parent,it would make it look like a real house if we took off the green piece
parent,come sit at the table and color
parent,how can we connect these pieces
parent,do you need help
parent,you 're walking the bear through the grass
child,"oh , come on"
parent,"he has big , stinky feet"
child,i am building a tower
parent,you are building a tower
parent,oh do n't put that in your mouth
parent,good thinking
child,i'm building a tower
parent,it has three windows
parent,you 're embarrassing me
child,we have more of these in my class
parent,yeah your school has tons of magna tiles
parent,you 're a good girl for playing
parent,you have to pick up the toys by yourself
parent,you drew a beautiful picture
parent,"oh , it s spicy , spicy , spicy pizza"
child,let 's play with the cars
parent,ok lets do that
child,i am making a spaceship
parent,you are making a spaceship
parent,you 're trying to get the game
parent,you made a tower
child,at our picnic feast
parent,"at our picnic , but we have to make our picnic"
child,i drew an ugly cat
parent,you drew an ugly cat
parent,do you like what i am making
parent,that 's not how that goes
child,then then why do they have six
parent,is not that a lovely design you made
parent,thanks for handing me that piece
parent,great house
parent,i like that you used your nice words to tell me about your day
parent,are n't we the coolest
parent,zebras have stripes
parent,do you remember that one time we went sledding at grandma 's house
parent,can you please put the red block on next
parent,thanks for putting on your jacket
parent,what letter does your first name start with
child,a car
parent,a car
parent,these toys are so cool
parent,what 's gonna go here
child,i like captain america
parent,you like captain america
parent,you found a yellow block
parent,check it out
child,it 's a puppy
parent,it is a puppy
parent,i like that
child,"oh , this is a big one"
parent,you wanna make one big one and put it in there
parent,a t'' goes next
parent,earlier we made a tower
child,i love the color red
parent,you love the color red
parent,that train is fast
child,you can t have ketchup
parent,"oh , yeah , you could if you wanted"
parent,you are being a good problem solver
parent,it looks like you 're trying to pull those pieces apart
child,the choo choo is turning
parent,the car is turning
parent,you 're making a tower
child,i dont go to the bathroom at all
parent,put the truck here and put the car beside it
child,zipper is the most cutest cuddliest kitty in the whole world
parent,zipper cuddles you at bedtime
child,i win
parent,you won our race
child,gym is fun
parent,you 're putting the piece in the wrong place
parent,i love when you are a good boy
child,look mom i made a train
parent,oh yeah a train
child,and then i will put some pizza
parent,"oh , you have a pizza"
parent,please hand me a yellow car
parent,not yet
parent,i love that you remembered to clean up without me asking you to
parent,you 're looking angry
parent,that looks good
parent,naughty boy
parent,wow you actually are sitting still
parent,"oh , thank you so much"
parent,please hurry up
parent,do n't take off your glasses again
parent,you are stacking the red block on the green block
child,a crayon
parent,will you need this car
parent,if you stop fussing i 'll give you a new game
parent,i love how creative you are
child,the flowers need to be pink
parent,oh pink
parent,that 's a horse
parent,did you put this orange in this pot
parent,that goes in this hole right
parent,bananas are n't blue (often when children make food out of play doh or color food parents criticize lack of realism )
parent,which one is bigger
child,my name starts with m
parent,your name starts with m
parent,calm down please
parent,we got them all lined up
child,here is your ice cream
parent,ice cream
parent,you found some
child,um we can use this as a plate
parent,oh yep
parent,you 're a good builder
child,i'm a basketball player
parent,you 're great
child,brmmmm
parent,brmmmm
child,this piece do n't fit
parent,the piece does n't fit and you 've tried all the places
parent,is the baby sick
parent,put the markers back
parent,give me some of the blocks
child,oh my
parent,oh my
parent,nice balancing
child,hes gone in the market
parent,i want you to start cleaning up
parent,that 's a magnificent truck
child,the cow is making a silly face
parent,that cow is making a silly face
parent,make it high okay
parent,that 's not nice
parent,are you making a train
parent,you 're making a tall tower
child,do you like my picture
parent,trees are n't red
parent,do n't bump your head darling
parent,how long
parent,they said to play with anything
child,here 's some pancakes for you
parent,some for me
child,i m going to try this one
parent,you re trying the dump truck
parent,shut up what 's with you today
parent,it does n't go like that
parent,nice job
parent,put it in the box okay
parent,ca n't you sit on the chair
child,i want to make a helicopter
parent,no there are n't enough pieces
parent,you pushed the dump truck down again
child,poop
parent,do n't say that
child,thats cool
parent,you need to
parent,i want you to play with me
child,break
parent,might break
parent,when playdough gets stuck it s really hard to get out
parent,oh
parent,can you make a circle
parent,you finished your tree
child,"you have to put the inaudible down , but you need a big car"
parent,oh
parent,bad
parent,try and stay in the lines
parent,would you like my help
parent,i'm putting a mouth on him
parent,that one is red
parent,uh oh
parent,you should color it blue
parent,count the toys
child,i ca n't do these any good
parent,that 's not true
child,(picks up blocks)
parent,you got a lot of blocks
child,because it won t work
parent,why not
child,i win
parent,you 're awesome
parent,connecting the track
parent,you drove the train
parent,you like those animals do n't you
parent,will you sit in your seat
parent,you did that fast
child,child is climbing on parent
parent,that makes me uncomfortable
parent,those are pretty beads you 're playing with
parent,the dolly is going to sleep
parent,you are building
child,you will see the
parent,you are playing with the magna doodles
child,i know how to take them out
parent,where 's mr potato head
parent,the cow is getting a drink of water
parent,that 's creative
parent,good idea
parent,put this piece here
child,i am nice
parent,no you 're not
parent,you 're sitting in a blue chair
parent,i like those colors
child,no i don t
parent,"oh , you didn t"
parent,marshmellows
child,three
parent,i need one more because i have seven and you have eight
parent,read this letter
parent,you can erase that
parent,you are adding the block to the tower
parent,thanks for sharing the toys with me
parent,is it just the yellow playdough
parent,i only got the head of this rabbit
parent,i ll choose the fig newton flavored cupcake
parent,you 're putting the red block on top of the yellow block
parent,you 're drawing a big apple
parent,that was smart to put the big one there
child,this one no fit to right here
parent,"no , it s not a gravedigger"
parent,you do n't want to play with this anymore
parent,do n't get out of your chair
parent,you 're putting the cars in the windowsill
parent,you found more pieces
parent,i like how carefully you 're driving that car
parent,you 're playing nicely with the toys
parent,you 're putting the block there
parent,i like how gently you are playing with me
child,lipstick
parent,lipstick
parent,you are doing a great job putting the toys away in the container
parent,repeating colors
parent,the is moving around
parent,make a rooster sound why do n't you
parent,find another short log
parent,can you find the pig
parent,oh that 's a cute idea
parent,i'm driving the car over here
parent,the penguin is swimming
parent,you knocked it over
parent,was n't that exciting
child,the plane is flying
parent,it is flying
parent,you knocked mr potato head off the table
child,mhmm
parent,that s cool
parent,did n't that make a big crash
child,i'm making a gun
parent,we do n't make guns
parent,is this fun
child,okay
parent,"oh , a donut cupcake"
parent,are you putting her on there next
child,why ca n't grandpa come over tonight
parent,grandpa 's cow had a new calf
parent,put them back
child,e
parent,that 's not an e
parent,good sitting
child,you wait here
parent,ok i 'll wait here
parent,look at the adorable kitten you drew
parent,you 're the best builder i 've seen
parent,are you baking in the oven
child,in here
parent,where did it go
parent,stack it high
child,yeah
parent,your picture is pretty
parent,you 've got all five cars on your side
child,i am going to be superman
parent,superman
parent,you are a smart little boy
child,let s first
parent,"oh , some tea"
parent,that 's awesome
parent,your teacher told me that you like to play legos at school too
child,look what i made
parent,look what you made
child,i made a drawing of you
parent,that 's not very pretty
parent,i like how fast you are cleaning up
parent,will you hand me the car
parent,you 're playing with legos
parent,i do n't like it when you talk like that
parent,you put an ear on your potato head
parent,your tree looks great
child,no response
parent,a cow or a giraffe
child,take it out
parent,"oh , you so smart"
parent,where did everybody go
parent,i want to play with the cars play cars with me
parent,thank you for sharing
parent,the gorilla likes the swing huh
parent,you 're making the cars go too fast they 're going to crash
parent,you got them apart
parent,you 're trying to put it on the cabinet
parent,is this my car
child,i like to eat apples and bananas
parent,apples and bananas
parent,you 're taking such good care of that baby doll
parent,you are frying an egg
parent,darn
parent,there 's a world map on that bulletin board
child,caterpillar
parent,you are coloring outside of the lines
parent,that 's weird lookin'
parent,you started building this tower with that big block
child,and the other person
parent,um
child,under the table
parent,under the table
child,can you play with me
parent,you want me to play
parent,the fence is keeping all the animals safe
parent,thank you for sitting quietly in your seat
child,now we only have one more
parent,one more
child,do you like my picture
parent,not really
parent,you 're sitting in your chair
parent,is mommy being silly
parent,let s play with the food right now
parent,you 're not even trying
child,child 's toy tower falls
parent,well when you build it that high of course it 's going to fall stop whining about it
parent,you are coloring so neatly
parent,you did a perfect job coloring that sun
parent,and holding her gently
child,those are your ears
parent,susie pick the crayon up off the floor
parent,this is so much fun
parent,i like the way you 're working to make it high
child,they are going to have a party
parent,the animals are going to have a party
parent,catch
parent,look at the awesome picture you drew
parent,you want to build a tower
parent,do n't bump your head
parent,you 're laughing
parent,thank you for helping pick up
parent,i love how you 're staying in your seat
parent,i love it when you give me hugs
parent,you picked a red one
child,lily lily
parent,we will talk about that later
parent,i like play doh
parent,that 's wonderful
parent,you 're a good girl for trying
child,carefully
parent,put that one right there on the corner
parent,thank you for giving it to me
parent,do you want to draw
parent,why not
parent,if you do n't sit down i 'll spank you
child,when you re a grownup you can do
parent,that s true
child,child that 's a red one
parent,that 's a red one
child,i'm coloring my picture blue
parent,you are coloring it blue
parent,stop being rough
parent,are you faster than superman
